{
  "data_product_id": "{{DATA_PRODUCT_ID}}",
  "organization_id": "{{ORGANIZATION_ID}}",
  "workflow_id": "{{WORKFLOW_ID}}",
  "domain_id": "{{DOMAIN_ID}}",
  "name": "Source data product",
  "description": "Data product to consume and deliver via webhook (select in studio)",
  "upstream_entity_id": null,
  "upstream_entity_type": null,
  "status": "draft",
  "governance": { "classification": "internal", "pii_fields": [], "compliance_requirements": [], "tags": [] },
  "metadata": { "template_slug": "consumption-webhook" },
  "created_at": "{{CREATED_AT}}",
  "updated_at": "{{UPDATED_AT}}"
}
