{
  "data_product_id": "{{DATA_PRODUCT_SINK_ID}}",
  "organization_id": "{{ORGANIZATION_ID}}",
  "workflow_id": "{{WORKFLOW_ID}}",
  "domain_id": "{{DOMAIN_ID}}",
  "upstream_entity_id": "{{CONNECTION_ID}}",
  "upstream_entity_type": "connections",
  "name": "Raw Orders",
  "description": "Raw order events from webhook ingestion",
  "owner": { "user_id": "{{OWNER_USER_ID}}" },
  "status": "draft",
  "governance": { "classification": "internal", "pii_fields": [], "compliance_requirements": [], "tags": [] },
  "metadata": { "template_slug": "orders-ingestion" },
  "created_at": "{{CREATED_AT}}",
  "updated_at": "{{UPDATED_AT}}",
  "odps_document": {
    "product": {
      "details": {
        "en": {
          "name": "Raw Orders",
          "description": "Raw order events from webhook ingestion",
          "status": "draft",
          "tags": [],
          "governanceProfile": "internal"
        }
      },
      "dataHolder": {
        "businessDomain": "{{DOMAIN_ID}}",
        "dataProductOwner": "{{OWNER_USER_ID}}"
      },
      "custom": {
        "loxtep": {
          "organization_id": "{{ORGANIZATION_ID}}",
          "domain_id": "{{DOMAIN_ID}}",
          "project_id": "{{PROJECT_ID}}",
          "workflow_id": "{{WORKFLOW_ID}}"
        }
      }
    }
  }
}
